{
  "intent": "Draft an email and revise it until it's professional",
  "family": "review_loop",
  "variant": "simple",
  "expected": {
    "min_nodes": 3,
    "node_types": ["llm_operator", "gate"],
    "topology": {
      "has_loops": true,
      "has_fan_out": false,
      "has_tools": false,
      "has_human_in_loop": false,
      "has_rag": false
    },
    "required_ports": ["text", "feedback"]
  },
  "notes": "Simple while-loop: draft -> review -> gate (accept/revise). Loop until quality threshold met."
}
