{
  "intent": "Create a multi-source research assistant that searches academic papers, web sources, and internal documents, cross-references findings, and produces a comprehensive report",
  "family": "rag_qa",
  "variant": "complex",
  "expected": {
    "min_nodes": 8,
    "node_types": ["rag_operator", "llm_operator", "tool_operator", "for_each", "reduce"],
    "topology": {
      "has_loops": false,
      "has_fan_out": true,
      "has_tools": true,
      "has_human_in_loop": false,
      "has_rag": true
    },
    "required_ports": ["query", "chunks", "text", "report"]
  },
  "notes": "Fan-out across three source types (academic, web, internal), parallel retrieval, cross-reference merge, final report synthesis."
}
