{
  "intent": "Answer a question using a document collection",
  "family": "rag_qa",
  "variant": "simple",
  "expected": {
    "min_nodes": 2,
    "node_types": ["rag_operator", "llm_operator"],
    "topology": {
      "has_loops": false,
      "has_fan_out": false,
      "has_tools": false,
      "has_human_in_loop": false,
      "has_rag": true
    },
    "required_ports": ["query", "chunks", "text"]
  },
  "notes": "Minimal RAG pipeline: retrieve relevant passages then synthesize an answer."
}
