{
  "intent": "Write code, run tests, and iteratively fix bugs until all tests pass",
  "family": "review_loop",
  "variant": "standard",
  "expected": {
    "min_nodes": 5,
    "node_types": ["llm_operator", "code_operator", "tool_operator", "gate"],
    "topology": {
      "has_loops": true,
      "has_fan_out": false,
      "has_tools": true,
      "has_human_in_loop": false,
      "has_rag": false
    },
    "required_ports": ["code", "test_results", "text"]
  },
  "notes": "Code-test-fix loop: generate code, execute tests via tool, review results, fix bugs if failing, gate on all-pass condition."
}
