{
  "intent": "Translate a document into 3 languages",
  "family": "fan_out_fan_in",
  "variant": "simple",
  "expected": {
    "min_nodes": 3,
    "node_types": ["llm_operator", "for_each", "reduce"],
    "topology": {
      "has_loops": false,
      "has_fan_out": true,
      "has_tools": false,
      "has_human_in_loop": false,
      "has_rag": false
    },
    "required_ports": ["text", "results"]
  },
  "notes": "ForEach over target languages, each branch translates the source document, reduce collects all translations."
}
